{
  "schema_version": 1,
  "version": "2.0.7",
  "id": "hyundai.elantra_n.2022-2026.dct",
  "name": "Hyundai Elantra N DCT",
  "years": "2022-2026",
  "transmission": "dct",
  "notes": "Calibrated from Elantra N DCT captures. 2.0.5: power/torque enabled - EMS16 TQI (0x260 D1) x0.390625, referenceTorqueNm 500, staticFrictionTorquePct 6.5. 2.0.6: rpm-dependent frictionTorqueCurve added (measured live TQFR 4.7%@2750 to 11.7%@5700 on the 2026-08-02 VN MT WOT capture, same G4KH engine; 6800 rpm tail point extrapolated); flat 6.5% overstated top-end power by ~5%. staticFrictionTorquePct kept as fallback for older apps. powerGaugeMaxHp 360. 2.0.7: RPM reverted from 0x162 to 0x366 D1:D2 (same as MT). The 2.0.0-2.0.6 '2025 CGW relocation' claim was wrong: 0x366 carries clean RPM on every EN capture 2022-2025, both transmissions (6 EN cars incl. a 2025 DCT at odo 8281 km; Kona N logs corroborate the same gateway layout), while 0x162 D1:D2 is NOT a plain RPM word: during DCT shift bursts (~0.6 s, 62% within 400 ms of a gear change) bit15 AND bit14 carry shift-phase flags and even the masked low bits deviate up to ~1800 rpm from true RPM - no bit mask makes 0x162 safe, do not resurrect it (16-bit reads produced the 14,692 rpm / 732 hp session-peak bug). removeSignals retires the stale (EngineRPM_2,0x162)/(FuelLevel,0x5CD) keys on overlay-composing app builds whose bundled tree predates 2.0.7; both entries are no-ops against this tree.",
  "removeSignals": [
    {"name": "EngineRPM_2", "canId": 354},
    {"name": "FuelLevel", "canId": 1485}
  ],
  "signals": [
    {
      "name": "VehicleSpeed",
      "canId": 870,
      "startBit": 40,
      "bitLength": 8,
      "isBigEndian": false,
      "isSigned": false,
      "factor": 1.0,
      "offset": 0.0,
      "minValue": 0.0,
      "maxValue": 255.0,
      "unit": "km/h",
      "description": "Vehicle speed from CAN 0x366 D5 (8-bit, km/h direct)."
    },
    {
      "name": "CurrentGear",
      "canId": 872,
      "startBit": 32,
      "bitLength": 4,
      "isBigEndian": false,
      "isSigned": false,
      "factor": 1.0,
      "offset": 0.0,
      "minValue": 0.0,
      "maxValue": 14.0,
      "unit": "",
      "description": "DCT gear from CAN 0x368 D4 low nibble (0=P/N, 1-8=Forward, 14=Reverse).",
      "valueMap": {
        "0": 0.0,
        "1": 1.0,
        "2": 2.0,
        "3": 3.0,
        "4": 4.0,
        "5": 5.0,
        "6": 6.0,
        "7": 7.0,
        "8": 8.0,
        "14": 14.0
      }
    },
    {
      "name": "IntakeTemp",
      "canId": 1107,
      "startBit": 16,
      "bitLength": 8,
      "isBigEndian": false,
      "isSigned": false,
      "factor": 0.75,
      "offset": -48.0,
      "minValue": -48.0,
      "maxValue": 143.25,
      "unit": "degC",
      "description": "Intake air temperature from CAN 0x453 D2."
    },
    {
      "name": "DriveMode_WithN",
      "canId": 1292,
      "startBit": 40,
      "bitLength": 8,
      "isBigEndian": false,
      "isSigned": false,
      "factor": 1.0,
      "offset": 0.0,
      "minValue": 0.0,
      "maxValue": 255.0,
      "unit": "",
      "description": "Active drive mode from CAN 0x50C D5."
    },
    {
      "name": "TPMS_FL",
      "canId": 1427,
      "startBit": 16,
      "bitLength": 8,
      "isBigEndian": false,
      "isSigned": false,
      "factor": 1.0,
      "offset": 0.0,
      "minValue": 0.0,
      "maxValue": 255.0,
      "unit": "psi",
      "description": "Front left tire pressure from CAN 0x593 D2."
    },
    {
      "name": "TPMS_FR",
      "canId": 1427,
      "startBit": 24,
      "bitLength": 8,
      "isBigEndian": false,
      "isSigned": false,
      "factor": 1.0,
      "offset": 0.0,
      "minValue": 0.0,
      "maxValue": 255.0,
      "unit": "psi",
      "description": "Front right tire pressure from CAN 0x593 D3."
    },
    {
      "name": "TPMS_RL",
      "canId": 1427,
      "startBit": 32,
      "bitLength": 8,
      "isBigEndian": false,
      "isSigned": false,
      "factor": 1.0,
      "offset": 0.0,
      "minValue": 0.0,
      "maxValue": 255.0,
      "unit": "psi",
      "description": "Rear left tire pressure from CAN 0x593 D4."
    },
    {
      "name": "TPMS_RR",
      "canId": 1427,
      "startBit": 40,
      "bitLength": 8,
      "isBigEndian": false,
      "isSigned": false,
      "factor": 1.0,
      "offset": 0.0,
      "minValue": 0.0,
      "maxValue": 255.0,
      "unit": "psi",
      "description": "Rear right tire pressure from CAN 0x593 D5."
    }
  ]
}
