{
  "schema_version": 1,
  "version": "1.0.0",
  "id": "hyundai.i20_n.2021-2024.manual",
  "name": "Hyundai i20 N MT",
  "years": "2021-2024",
  "transmission": "manual",
  "notes": "1.0.0: signal definitions copied from hyundai.veloster_n.2019-2022.manual 1.0.9 (same-generation Hyundai N CAN layout). Not yet validated on a i20 N capture. Power/torque disabled: the Veloster N model's 500 Nm reference torque is for the 2.0T G4KH, not the i20 N's 1.6T.",
  "signals": [
    {
      "name": "AccelPedalPos",
      "canId": 809,
      "startBit": 48,
      "bitLength": 8,
      "isBigEndian": false,
      "isSigned": false,
      "factor": 0.392157,
      "offset": 0.0,
      "minValue": 0.0,
      "maxValue": 100.01,
      "unit": "%",
      "description": "Accelerator pedal position fallback from EMS16 (0x329) D6."
    },
    {
      "name": "LongAccel",
      "canId": 1181,
      "startBit": 24,
      "bitLength": 12,
      "isBigEndian": false,
      "isSigned": false,
      "factor": 0.0018,
      "offset": -3.6864,
      "minValue": -3.69,
      "maxValue": 3.68,
      "unit": "G",
      "description": "Longitudinal acceleration from CAN 0x49D D3 + D4[3:0] (12-bit, manual layout)."
    },
    {
      "name": "YawRate",
      "canId": 544,
      "startBit": 40,
      "bitLength": 12,
      "isBigEndian": false,
      "isSigned": true,
      "factor": 0.01,
      "offset": 0.0,
      "minValue": -20.48,
      "maxValue": 20.47,
      "unit": "deg/s",
      "description": "Yaw rate from ESP12 (0x220) D5 + D6[3:0] (12-bit manual layout)."
    },
    {
      "name": "SteeringSpeed",
      "canId": 688,
      "startBit": 16,
      "bitLength": 8,
      "isBigEndian": false,
      "isSigned": false,
      "factor": 4.0,
      "offset": 0.0,
      "minValue": 0.0,
      "maxValue": 1020.0,
      "unit": "deg/s",
      "description": "Steering wheel rotation speed from SAS11 (0x2B0) D2 (8-bit manual layout)."
    },
    {
      "name": "ClutchSwitch",
      "canId": 809,
      "startBit": 31,
      "bitLength": 1,
      "isBigEndian": false,
      "isSigned": false,
      "factor": 1.0,
      "offset": 0.0,
      "minValue": 0.0,
      "maxValue": 1.0,
      "unit": "",
      "description": "Clutch pedal switch from 0x329 D3 bit 7 (1 = pressed)."
    },
    {
      "name": "BrakeSwitch",
      "canId": 809,
      "startBit": 33,
      "bitLength": 1,
      "isBigEndian": false,
      "isSigned": false,
      "factor": 1.0,
      "offset": 0.0,
      "minValue": 0.0,
      "maxValue": 1.0,
      "unit": "",
      "description": "Brake pedal switch from 0x329 D4 bit 1 (1 = pressed)."
    },
    {
      "name": "WheelSpeed_FL",
      "canId": 902,
      "startBit": 0,
      "bitLength": 14,
      "isBigEndian": false,
      "isSigned": false,
      "factor": 0.03125,
      "offset": 0.0,
      "minValue": 0.0,
      "maxValue": 511.0,
      "unit": "km/h",
      "description": "Front left wheel speed (14-bit, manual layout)."
    },
    {
      "name": "WheelSpeed_FR",
      "canId": 902,
      "startBit": 16,
      "bitLength": 14,
      "isBigEndian": false,
      "isSigned": false,
      "factor": 0.03125,
      "offset": 0.0,
      "minValue": 0.0,
      "maxValue": 511.0,
      "unit": "km/h",
      "description": "Front right wheel speed (14-bit, manual layout)."
    },
    {
      "name": "WheelSpeed_RL",
      "canId": 902,
      "startBit": 32,
      "bitLength": 14,
      "isBigEndian": false,
      "isSigned": false,
      "factor": 0.03125,
      "offset": 0.0,
      "minValue": 0.0,
      "maxValue": 511.0,
      "unit": "km/h",
      "description": "Rear left wheel speed (14-bit, manual layout)."
    },
    {
      "name": "WheelSpeed_RR",
      "canId": 902,
      "startBit": 48,
      "bitLength": 14,
      "isBigEndian": false,
      "isSigned": false,
      "factor": 0.03125,
      "offset": 0.0,
      "minValue": 0.0,
      "maxValue": 511.0,
      "unit": "km/h",
      "description": "Rear right wheel speed (14-bit, manual layout)."
    },
    {
      "name": "CurrentGear",
      "canId": 1170,
      "startBit": 40,
      "bitLength": 8,
      "isBigEndian": false,
      "isSigned": false,
      "factor": 0.0,
      "offset": 0.0,
      "minValue": 0.0,
      "maxValue": 6.0,
      "unit": "",
      "description": "Manual transmission current gear from 0x492 D5. 0x88..0xB0 map to gears 1..6; 0x80 shift/unknown; 0xB8 neutral.",
      "valueMap": {
        "128": 0.0,
        "136": 1.0,
        "144": 2.0,
        "152": 3.0,
        "160": 4.0,
        "168": 5.0,
        "176": 6.0,
        "184": 0.0
      }
    },
    {
      "name": "NMode_Engine",
      "canId": 1184,
      "startBit": 0,
      "bitLength": 2,
      "isBigEndian": false,
      "isSigned": false,
      "factor": 1.0,
      "offset": 0.0,
      "minValue": 0.0,
      "maxValue": 3.0,
      "unit": "",
      "description": "N Mode Engine setting (0=Normal, 1=Sport, 2=Sport+, 3=unset/default)."
    },
    {
      "name": "NMode_Suspension",
      "canId": 1184,
      "startBit": 2,
      "bitLength": 2,
      "isBigEndian": false,
      "isSigned": false,
      "factor": 1.0,
      "offset": 0.0,
      "minValue": 0.0,
      "maxValue": 3.0,
      "unit": "",
      "description": "N Mode Suspension setting (0=Comfort, 1=Normal, 2=Sport, 3=unset/default)."
    },
    {
      "name": "NMode_ESC",
      "canId": 1184,
      "startBit": 4,
      "bitLength": 2,
      "isBigEndian": false,
      "isSigned": false,
      "factor": 1.0,
      "offset": 0.0,
      "minValue": 0.0,
      "maxValue": 3.0,
      "unit": "",
      "description": "N Mode ESC setting (0=On, 1=Sport, 2=Off, 3=unset/default)."
    },
    {
      "name": "NMode_Exhaust",
      "canId": 1184,
      "startBit": 6,
      "bitLength": 2,
      "isBigEndian": false,
      "isSigned": false,
      "factor": 1.0,
      "offset": 0.0,
      "minValue": 0.0,
      "maxValue": 3.0,
      "unit": "",
      "description": "N Mode Exhaust setting (0=Quiet, 1=Normal, 2=Sport+, 3=unset/default)."
    },
    {
      "name": "NMode_RevMatch",
      "canId": 1184,
      "startBit": 8,
      "bitLength": 1,
      "isBigEndian": false,
      "isSigned": false,
      "factor": 1.0,
      "offset": 0.0,
      "minValue": 0.0,
      "maxValue": 1.0,
      "unit": "",
      "description": "N Mode Rev-match enabled (0=Off, 1=On)."
    },
    {
      "name": "NMode_eLSD",
      "canId": 1184,
      "startBit": 10,
      "bitLength": 2,
      "isBigEndian": false,
      "isSigned": false,
      "factor": 1.0,
      "offset": 0.0,
      "minValue": 0.0,
      "maxValue": 3.0,
      "unit": "",
      "description": "N Mode e-LSD setting (0=Normal, 1=Sport, 2=Sport+, 3=unset/default)."
    },
    {
      "name": "NMode_Steering",
      "canId": 1184,
      "startBit": 12,
      "bitLength": 2,
      "isBigEndian": false,
      "isSigned": false,
      "factor": 1.0,
      "offset": 0.0,
      "minValue": 0.0,
      "maxValue": 3.0,
      "unit": "",
      "description": "N Mode Steering setting (0=Comfort, 1=Normal, 2=Sport, 3=unset/default)."
    },
    {
      "name": "ManifoldPressure",
      "canId": 1367,
      "startBit": 32,
      "bitLength": 8,
      "isBigEndian": false,
      "isSigned": false,
      "factor": 1.0,
      "offset": 0.0,
      "minValue": 0.0,
      "maxValue": 255.0,
      "unit": "kPa",
      "description": "Manifold absolute pressure from MAP (0x557) D4, kPa absolute. Validated on the 2026-08-02 MT WOT capture: 28 kPa overrun vacuum to 245 kPa (~21 psi boost) at WOT, r=0.995 against TQI. (Description previously misprinted the ID as 0x547; canId 1367 = 0x557 was always correct.)"
    },
    {
      "name": "BatteryCurrent",
      "canId": 1353,
      "startBit": 0,
      "bitLength": 16,
      "isBigEndian": false,
      "isSigned": false,
      "factor": 0.01,
      "offset": -327.68,
      "minValue": -327.68,
      "maxValue": 327.67,
      "unit": "A",
      "description": "Battery current. Unsigned 16-bit LE centered at raw 32768 = 0A. Negative = charging."
    },
    {
      "name": "IntakeTemp",
      "canId": 1351,
      "startBit": 16,
      "bitLength": 8,
      "isBigEndian": false,
      "isSigned": false,
      "factor": 0.75,
      "offset": -48.0,
      "minValue": -48.0,
      "maxValue": 143.25,
      "unit": "degC",
      "description": "Intake air temperature fallback from INTAKE_TEMP_2 (0x547) D2."
    }
  ]
}
