{
  "schema_version": 1,
  "version": "1.0.0",
  "id": "hyundai.i30_n.2017-2025.dct",
  "name": "Hyundai i30 N DCT",
  "years": "2017-2025",
  "transmission": "dct",
  "notes": "1.0.0: signal definitions copied from hyundai.veloster_n.2019-2022.dct 1.0.9 (same-generation Hyundai N CAN layout). Not yet validated on a i30 N capture.",
  "signals": [
    {
      "name": "CurrentGear",
      "canId": 274,
      "startBit": 8,
      "bitLength": 4,
      "isBigEndian": false,
      "isSigned": false,
      "factor": 1.0,
      "offset": 0.0,
      "minValue": 0.0,
      "maxValue": 14.0,
      "unit": "",
      "description": "DCT gear position from CAN 0x112 (0=Neutral, 1-8=Forward, 14=Reverse)."
    },
    {
      "name": "YawRate",
      "canId": 544,
      "startBit": 48,
      "bitLength": 16,
      "isBigEndian": false,
      "isSigned": true,
      "factor": 0.01,
      "offset": -40.95,
      "minValue": 0.0,
      "maxValue": 0.0,
      "unit": "deg/s",
      "description": "Vehicle yaw rate from CAN 0x220 (16-bit signed, DCT layout). min/max intentionally 0/0 (no range enforcement): signed/offset encoding is a known-open calibration - do not enforce a range until recalibrated."
    },
    {
      "name": "SteeringSpeed",
      "canId": 688,
      "startBit": 16,
      "bitLength": 16,
      "isBigEndian": false,
      "isSigned": false,
      "factor": 4.0,
      "offset": 0.0,
      "minValue": 0.0,
      "maxValue": 262140.0,
      "unit": "deg/s",
      "description": "Steering wheel rotation speed (DCT 16-bit SAS11)."
    },
    {
      "name": "LongAccel",
      "canId": 1181,
      "startBit": 24,
      "bitLength": 16,
      "isBigEndian": false,
      "isSigned": false,
      "factor": 0.000127465,
      "offset": -0.261009,
      "minValue": -0.27,
      "maxValue": 8.09,
      "unit": "G",
      "description": "Longitudinal acceleration from CAN 0x49D D4:D5 (16-bit DCT formula)."
    },
    {
      "name": "ClutchSwitch",
      "canId": 809,
      "startBit": 8,
      "bitLength": 1,
      "isBigEndian": false,
      "isSigned": false,
      "factor": 1.0,
      "offset": 0.0,
      "minValue": 0.0,
      "maxValue": 1.0,
      "unit": "",
      "description": "Clutch pedal switch (1 = pressed)."
    },
    {
      "name": "BrakeSwitch",
      "canId": 809,
      "startBit": 9,
      "bitLength": 1,
      "isBigEndian": false,
      "isSigned": false,
      "factor": 1.0,
      "offset": 0.0,
      "minValue": 0.0,
      "maxValue": 1.0,
      "unit": "",
      "description": "Brake pedal switch (1 = pressed)."
    },
    {
      "name": "WheelSpeed_FL",
      "canId": 902,
      "startBit": 0,
      "bitLength": 16,
      "isBigEndian": false,
      "isSigned": false,
      "factor": 0.03125,
      "offset": 0.0,
      "minValue": 0.0,
      "maxValue": 300.0,
      "unit": "km/h",
      "description": "Front left wheel speed (Veloster DCT 16-bit)."
    },
    {
      "name": "WheelSpeed_FR",
      "canId": 902,
      "startBit": 16,
      "bitLength": 16,
      "isBigEndian": false,
      "isSigned": false,
      "factor": 0.03125,
      "offset": 0.0,
      "minValue": 0.0,
      "maxValue": 300.0,
      "unit": "km/h",
      "description": "Front right wheel speed (Veloster DCT 16-bit)."
    },
    {
      "name": "WheelSpeed_RL",
      "canId": 902,
      "startBit": 32,
      "bitLength": 16,
      "isBigEndian": false,
      "isSigned": false,
      "factor": 0.03125,
      "offset": 0.0,
      "minValue": 0.0,
      "maxValue": 300.0,
      "unit": "km/h",
      "description": "Rear left wheel speed (Veloster DCT 16-bit)."
    },
    {
      "name": "WheelSpeed_RR",
      "canId": 902,
      "startBit": 48,
      "bitLength": 16,
      "isBigEndian": false,
      "isSigned": false,
      "factor": 0.03125,
      "offset": 0.0,
      "minValue": 0.0,
      "maxValue": 300.0,
      "unit": "km/h",
      "description": "Rear right wheel speed (Veloster DCT 16-bit)."
    },
    {
      "name": "NMode_Engine",
      "canId": 1184,
      "startBit": 0,
      "bitLength": 2,
      "isBigEndian": false,
      "isSigned": false,
      "factor": 1.0,
      "offset": 0.0,
      "minValue": 0.0,
      "maxValue": 3.0,
      "unit": "",
      "description": "N Mode Engine setting (0=Normal, 1=Sport, 2=Sport+)."
    },
    {
      "name": "NMode_Suspension",
      "canId": 1184,
      "startBit": 2,
      "bitLength": 2,
      "isBigEndian": false,
      "isSigned": false,
      "factor": 1.0,
      "offset": 0.0,
      "minValue": 0.0,
      "maxValue": 3.0,
      "unit": "",
      "description": "N Mode Suspension setting (0=Comfort, 1=Normal, 2=Sport)."
    },
    {
      "name": "NMode_ESC",
      "canId": 1184,
      "startBit": 4,
      "bitLength": 2,
      "isBigEndian": false,
      "isSigned": false,
      "factor": 1.0,
      "offset": 0.0,
      "minValue": 0.0,
      "maxValue": 3.0,
      "unit": "",
      "description": "N Mode ESC setting (0=On, 1=Sport, 2=Off)."
    },
    {
      "name": "NMode_Exhaust",
      "canId": 1184,
      "startBit": 6,
      "bitLength": 2,
      "isBigEndian": false,
      "isSigned": false,
      "factor": 1.0,
      "offset": 0.0,
      "minValue": 0.0,
      "maxValue": 3.0,
      "unit": "",
      "description": "N Mode Exhaust setting (0=Quiet, 1=Normal, 2=Sport+)."
    },
    {
      "name": "NMode_RevMatch",
      "canId": 1184,
      "startBit": 8,
      "bitLength": 1,
      "isBigEndian": false,
      "isSigned": false,
      "factor": 1.0,
      "offset": 0.0,
      "minValue": 0.0,
      "maxValue": 1.0,
      "unit": "",
      "description": "N Mode Rev-match enabled (0=Off, 1=On)."
    },
    {
      "name": "NMode_eLSD",
      "canId": 1184,
      "startBit": 10,
      "bitLength": 2,
      "isBigEndian": false,
      "isSigned": false,
      "factor": 1.0,
      "offset": 0.0,
      "minValue": 0.0,
      "maxValue": 3.0,
      "unit": "",
      "description": "N Mode e-LSD setting (0=Normal, 1=Sport, 2=Sport+)."
    },
    {
      "name": "NMode_Steering",
      "canId": 1184,
      "startBit": 12,
      "bitLength": 2,
      "isBigEndian": false,
      "isSigned": false,
      "factor": 1.0,
      "offset": 0.0,
      "minValue": 0.0,
      "maxValue": 3.0,
      "unit": "",
      "description": "N Mode Steering setting (0=Comfort, 1=Normal, 2=Sport)."
    },
    {
      "name": "ManifoldPressure",
      "canId": 1349,
      "startBit": 0,
      "bitLength": 8,
      "isBigEndian": false,
      "isSigned": false,
      "factor": 10.731613,
      "offset": 458.98,
      "minValue": 458.98,
      "maxValue": 3195.59,
      "unit": "mmHg",
      "description": "Manifold absolute pressure."
    },
    {
      "name": "BatteryCurrent",
      "canId": 1353,
      "startBit": 0,
      "bitLength": 16,
      "isBigEndian": false,
      "isSigned": false,
      "factor": 0.01,
      "offset": -327.68,
      "minValue": -327.68,
      "maxValue": 327.67,
      "unit": "A",
      "description": "Battery current (positive = charging). Encoding matched to the validated manual variant (unsigned, centered -327.68): the old isSigned+offset-327.0 pair could never represent charging current above +0.67 A."
    }
  ]
}
