{
  "schema_version": 1,
  "version": "2.0.7",
  "id": "hyundai.elantra_n.2022-2026.manual",
  "name": "Hyundai Elantra N MT",
  "years": "2022-2026",
  "transmission": "manual",
  "notes": "Calibrated against kdmlinktest2.csv Elantra N manual capture. TPMS omitted (0x593 carries 0xFF only). 2.0.5: power/torque enabled - EMS16 TQI (0x260 D1) x0.390625, referenceTorqueNm 500, staticFrictionTorquePct 6.5. 2.0.6: rpm-dependent frictionTorqueCurve added (measured live TQFR 4.7%@2750 to 11.7%@5700 on the 2026-08-02 VN MT WOT capture, same G4KH engine; 6800 rpm tail point extrapolated); flat 6.5% overstated top-end power by ~5%. staticFrictionTorquePct kept as fallback for older apps. powerGaugeMaxHp 360. 2.0.7: inherits the model-base FuelLevel fix - 0x5CD D0 was a constant non-fuel byte (the stuck-fuel bug); fuel now decodes 0x50C D3:D4 sender counts (verified decreasing across MT captures, full-tank rail 2358 counts on the Jun-15 MT log).",
  "removeSignals": [
    {"name": "FuelLevel", "canId": 1485}
  ],
  "signals": [
    {
      "name": "ClutchSwitch",
      "canId": 809,
      "startBit": 31,
      "bitLength": 1,
      "isBigEndian": false,
      "isSigned": false,
      "factor": 1.0,
      "offset": 0.0,
      "minValue": 0.0,
      "maxValue": 1.0,
      "unit": "",
      "description": "Clutch pedal switch from CAN 0x329 D3 bit 7."
    },
    {
      "name": "BrakeSwitch",
      "canId": 809,
      "startBit": 33,
      "bitLength": 1,
      "isBigEndian": false,
      "isSigned": false,
      "factor": 1.0,
      "offset": 0.0,
      "minValue": 0.0,
      "maxValue": 1.0,
      "unit": "",
      "description": "Brake pedal switch from CAN 0x329 D4 bit 1."
    },
    {
      "name": "CurrentGear",
      "canId": 1170,
      "startBit": 40,
      "bitLength": 8,
      "isBigEndian": false,
      "isSigned": false,
      "factor": 0.0,
      "offset": 0.0,
      "minValue": 0.0,
      "maxValue": 6.0,
      "unit": "",
      "description": "Manual transmission current gear from CAN 0x492 D5. 0x80 is a shift/unknown transition state and is ignored; 0xB8 is neutral.",
      "ignoredRawValues": [
        128
      ],
      "valueMap": {
        "136": 1.0,
        "144": 2.0,
        "152": 3.0,
        "160": 4.0,
        "168": 5.0,
        "176": 6.0,
        "184": 0.0
      }
    },
    {
      "name": "NMode_Engine",
      "canId": 1184,
      "startBit": 0,
      "bitLength": 2,
      "isBigEndian": false,
      "isSigned": false,
      "factor": 1.0,
      "offset": 0.0,
      "minValue": 0.0,
      "maxValue": 3.0,
      "unit": "",
      "description": "N Mode engine setting from CAN 0x4A0."
    },
    {
      "name": "NMode_Suspension",
      "canId": 1184,
      "startBit": 2,
      "bitLength": 2,
      "isBigEndian": false,
      "isSigned": false,
      "factor": 1.0,
      "offset": 0.0,
      "minValue": 0.0,
      "maxValue": 3.0,
      "unit": "",
      "description": "N Mode suspension setting from CAN 0x4A0."
    },
    {
      "name": "NMode_ESC",
      "canId": 1184,
      "startBit": 4,
      "bitLength": 2,
      "isBigEndian": false,
      "isSigned": false,
      "factor": 1.0,
      "offset": 0.0,
      "minValue": 0.0,
      "maxValue": 3.0,
      "unit": "",
      "description": "N Mode ESC setting from CAN 0x4A0."
    },
    {
      "name": "NMode_Exhaust",
      "canId": 1184,
      "startBit": 6,
      "bitLength": 2,
      "isBigEndian": false,
      "isSigned": false,
      "factor": 1.0,
      "offset": 0.0,
      "minValue": 0.0,
      "maxValue": 3.0,
      "unit": "",
      "description": "N Mode exhaust setting from CAN 0x4A0."
    },
    {
      "name": "NMode_RevMatch",
      "canId": 1184,
      "startBit": 8,
      "bitLength": 1,
      "isBigEndian": false,
      "isSigned": false,
      "factor": 1.0,
      "offset": 0.0,
      "minValue": 0.0,
      "maxValue": 1.0,
      "unit": "",
      "description": "N Mode rev-match enabled from CAN 0x4A0 D1 bit 0."
    },
    {
      "name": "NMode_eLSD",
      "canId": 1184,
      "startBit": 10,
      "bitLength": 2,
      "isBigEndian": false,
      "isSigned": false,
      "factor": 1.0,
      "offset": 0.0,
      "minValue": 0.0,
      "maxValue": 3.0,
      "unit": "",
      "description": "N Mode e-LSD setting from CAN 0x4A0."
    },
    {
      "name": "NMode_Steering",
      "canId": 1184,
      "startBit": 12,
      "bitLength": 2,
      "isBigEndian": false,
      "isSigned": false,
      "factor": 1.0,
      "offset": 0.0,
      "minValue": 0.0,
      "maxValue": 3.0,
      "unit": "",
      "description": "N Mode steering setting from CAN 0x4A0."
    },
    {
      "name": "DriveMode_WithN",
      "canId": 1292,
      "startBit": 0,
      "bitLength": 8,
      "isBigEndian": false,
      "isSigned": false,
      "factor": 1.0,
      "offset": 0.0,
      "minValue": 0.0,
      "maxValue": 255.0,
      "unit": "",
      "description": "Active drive mode raw byte from CAN 0x50C D0."
    }
  ]
}
